{
  "claim_id": "claim_36ee156b0635e1588fc7b08d237acf532058cb38233edee4b6d41e040d85ba15",
  "denominator": 2,
  "denominator_membership_sha256": "b1fccd02450b32284a84a3873e5f809fefbd32f5fd49c8b2911662783af4a197",
  "evidence_pack_id": "epack_0c9e12530f22d6e2b00d766aaee6e2fb38a59247d8bd51e4351b0247d97cbc29",
  "expectation_id": "expect_a916c4ebeb7392da57256cea9417eaf953130774b1eafc42c9ba2e33b6c2f7c9",
  "limitations_sha256": "ff0f8d0b95e442cce10b555cbb5515397e9aa2a9859823304a32915064db59a5",
  "numerator": 1,
  "numerator_membership_sha256": "5e4418d026b0d66fda8c86c7bac1bc6ec9f18955c52cd444a86deb0abb954a7b",
  "projections_sha256": "67511b4b38ef07503022a5ca52cac8155dd728595a37ba91773639fc76174581",
  "query_sha256": "f65c9303a2799cf319137b22666b2cde66db19c9832a7dda153f072b2343ea73",
  "schema_version": "1.0",
  "shapes_sha256": "aaaaaaaaaaaaaaaaaaaaaaaaaaaaaaaaaaaaaaaaaaaaaaaaaaaaaaaaaaaaaaaa",
  "snapshot_manifest_sha256": "bbbbbbbbbbbbbbbbbbbbbbbbbbbbbbbbbbbbbbbbbbbbbbbbbbbbbbbbbbbbbbbb",
  "unit": "legal_event"
}
